{
  "schema_version": 1,
  "revision": 3,
  "sequence": 2,
  "status": "ACTIVE",
  "integration_token": "integration-relay-conversation-isolation-close-2-20260806T122700Z",
  "work_item_id": "RELAY-CONVERSATION-ISOLATION-CLOSE",
  "started_at": "2026-08-06T12:27:00Z",
  "expires_at": "2026-08-06T13:27:00Z"
}
